{
  "$schema": "../../schemas/release-manifest.schema.json",
  "schema_version": "1.0.0",
  "release_id": "CMV-v0.1.0-dev",
  "release_type": "SOFTWARE",
  "candidate_commit_sha": "687975e488e57d97491a3b5585f4e25a41d63dff",
  "intended_tag": "CMV-v0.1.0-dev",
  "environment_id": "ENV-0005",
  "release_notes": "docs/tooling/CORPUS_MANIFEST_VERIFIER.md",
  "artifacts": [
    {"name": "hms_tools/corpus_manifest.py", "sha256": "870a7f39d6d63fe61fa63223e27d8f3ec60047f5737bb50d44df3c284dc6ee4d"},
    {"name": "scripts/corpus_manifest.py", "sha256": "ee6f2981a398b03568d74fd21f70fe7cf6c97ec9a0fc65a81cb430351782cb1e"},
    {"name": "scripts/corpus_verifier_app.py", "sha256": "5c06b1eb95caeab3a98005d44455346edd301d0a388f3f6005ef61d235142c6e"},
    {"name": "scripts/build_corpus_verifier_windows.py", "sha256": "a4b54c53e0f47d754799bdb837a267044b9b3d5e4f5600f873a7fc575dcf9206"},
    {"name": "schemas/corpus-manifest.schema.json", "sha256": "4d05fda8e846f7aa238461ba048ba0016a8c004d87e6abc5bc63c2b544d764c5"},
    {"name": "schemas/corpus-verification.schema.json", "sha256": "2b123be3af77392c16a6c9154ef458899fd20783a531405a78214a68a036d02a"},
    {"name": "tests/test_corpus_manifest.py", "sha256": "0e5d62a000802ad546734173aa782fb3c0546876e1daef2f2be572c54876834d"},
    {"name": "docs/tooling/CORPUS_MANIFEST_VERIFIER.md", "sha256": "3d490a6530d6f2f836ab2b4cb9cc6c79dd43bc949940fece1d6d34a0cfebadf9"},
    {"name": "requirements-build.txt", "sha256": "be3e2c617a15c6263b4c0f70acb47792fde84d455139e1bc44f9fd4f1548c3a1"},
    {"name": "HMS-Corpus-Verifier-v0.1.0-dev-Windows-x64-portable.zip", "sha256": "055899c61efb8c6c7d5868851099dd05e4d8c83cd3521fdb8a77d2c1ddcfaa1f"}
  ]
}
