{
  "$schema": "../../schemas/release-manifest.schema.json",
  "schema_version": "1.0.0",
  "release_id": "CMV-v0.1.0-rc.3",
  "release_type": "SOFTWARE",
  "candidate_commit_sha": "30535ff418d39d9e820a35fa2dee374659231f20",
  "intended_tag": "CMV-v0.1.0-rc.3",
  "environment_id": "ENV-0011",
  "release_notes": "releases/CMV-v0.1.0-rc.3.md",
  "artifacts": [
    {"name":"hms_tools/corpus_manifest.py","sha256":"aaa100c38053f76a0c5d660893845538c48e43971032e83e19729abced37b415"},
    {"name":"scripts/corpus_manifest.py","sha256":"32370eb3507982848c2beaf8dfd7fb192df01060550f02d5b16507810307f57c"},
    {"name":"scripts/corpus_verifier_app.py","sha256":"cce58a80640d03f834575d43f1cacada411a9229d04e226279a08be0904dd6b8"},
    {"name":"scripts/build_corpus_verifier_windows.py","sha256":"19689e294d763c8de4abe2dba45df54d2d82eea732993bd2762419c28f6bc9d3"},
    {"name":"corpus/liber-primus/manifests/LP-75-IMAGES-v1.0.0.json","sha256":"76d67e34f04b0125ad9b2893cd68b11510bb4e7e37ec2bb1849760e487a31978"},
    {"name":"schemas/corpus-manifest.schema.json","sha256":"4d05fda8e846f7aa238461ba048ba0016a8c004d87e6abc5bc63c2b544d764c5"},
    {"name":"schemas/corpus-verification.schema.json","sha256":"2b123be3af77392c16a6c9154ef458899fd20783a531405a78214a68a036d02a"},
    {"name":"tests/test_corpus_manifest.py","sha256":"ac688f8384a10a7d0dedf65a62dd6c46acbbc709ad529822bb0cf1d88d03805c"},
    {"name":"tests/test_corpus_package.py","sha256":"abcd697907fbf4ab351ac066d3deb36fa61b966bde5af2144ef0fcc34f34c42f"},
    {"name":"docs/tooling/CORPUS_MANIFEST_VERIFIER.md","sha256":"cb2cb502ca6fffe12677022cf6d41443909d34f89f514cd2ddecba7e713dd8bf"},
    {"name":"docs/tooling/CORPUS_VERIFIER_UAT_V0.1.0_RC3.md","sha256":"c65d5285eb3b6a6ba83f350e4906598d464fb3e291fe15825d2528a722260631"},
    {"name":"requirements-build.txt","sha256":"bf1abe2ece931e3bf2c4698e45dd6cc5279bb4a918cd676a3794d6b645ec6307"},
    {"name":"HMS-Corpus-Verifier-v0.1.0-rc.3-Windows-x64-portable.zip","sha256":"dc0366e6c506a02ad12f5846d373d671242518f778dedc9706b00400ed562125"}
  ]
}
